{
  "schema_version": "1.0.0",
  "run_id": "52d0be6d56da45b6ac37eaf53033936f",
  "timestamp": "2026-10-15T13:03:22.763506+00:00",
  "model_id": "ifcopenhouse",
  "model_sha256": "71c9466bf02306be58d45b77d738541a0e7410767960b5eed1cf85737dfa34c9",
  "input_sha256": "2a13eec2637ff06d462b3bad110526f5c4e3412c8a9363283bed24d3b6936702",
  "is_synthetic": false,
  "full_clause_compliance_evaluated": false,
  "summary": {
    "rule_count": 9,
    "instance_count": 9,
    "PASS": 0,
    "FAIL": 0,
    "NOT CHECKABLE": 9,
    "NOT_APPLICABLE": 0,
    "completed_determination_rate": 0.0,
    "determined_pass_rate": null
  },
  "results": [
    {
      "instance_id": "parking-minimum:0",
      "rule_id": "parking-minimum",
      "rule_version": "1.0.0",
      "chapter": 11,
      "topic": "Accessibility",
      "status": "UNKNOWN",
      "display_status": "NOT CHECKABLE",
      "result_scope": "COUNT_ONLY",
      "full_clause_compliance_evaluated": false,
      "why": {
        "source_node_id": "ibc2021-1106.2",
        "rule_version": "1.0.0",
        "contract_sha256": "bd8d8b5550b33fb1be6130ed2d2cb5da80677f243ea74801bcdf4a61565e7eb3",
        "text": "1106.2 Required. Where parking is provided, accessible parking spaces shall be provided in compliance with Table 1106.2, except as required by Sections 1106.3 through 1106.5. Where more than one parking facility is provided on a site, the number of parking spaces required to be accessible shall be calculated separately for each parking facility.",
        "sha256": "676409a003c7399d1ced1cadbfc2c9fd2298a8d01cfae5b5951ca40911f1098b",
        "source_pdf": "IBE2021_11Accessibility.pdf",
        "pdf_file": "IBC2021_Chapter11.pdf",
        "fragments": [
          {
            "pdf_page_number": 4,
            "source_pdf_page": 359,
            "column": "left",
            "bbox": [
              46.797,
              286.763,
              289.893,
              352.728
            ],
            "line_ids": [
              "p004-b009-l001",
              "p004-b009-l002",
              "p004-b009-l003",
              "p004-b009-l004",
              "p004-b009-l005",
              "p004-b009-l006"
            ],
            "block_ids": [
              "p004-b009"
            ]
          }
        ],
        "context": {
          "source_node_id": "ibc2021-1106.2",
          "structural_and_numbered_ancestor_ids": [
            "ibc2021-11",
            "ibc2021-1106"
          ],
          "exception_node_ids": [
            "ibc2021-n0052"
          ],
          "reference_node_ids": [
            "ibc2021-1106.2",
            "ibc2021-1106.3",
            "ibc2021-1106.5"
          ],
          "expanded_range_node_ids": [
            "ibc2021-1106.3",
            "ibc2021-1106.4",
            "ibc2021-1106.5"
          ],
          "referenced_subsection_ids": [],
          "global_scope_review_ids": [
            "ibc2021-1102.1",
            "ibc2021-1103.1",
            "ibc2021-1103.2",
            "ibc2021-1103.2.1",
            "ibc2021-1103.2.2",
            "ibc2021-1103.2.3",
            "ibc2021-1103.2.4",
            "ibc2021-1103.2.5",
            "ibc2021-1103.2.6",
            "ibc2021-1103.2.7",
            "ibc2021-1103.2.8",
            "ibc2021-1103.2.9",
            "ibc2021-1103.2.10",
            "ibc2021-1103.2.11",
            "ibc2021-1103.2.12",
            "ibc2021-1103.2.13",
            "ibc2021-1103.2.14"
          ],
          "unresolved_references": [],
          "range_review_items": [],
          "evidence_node_ids": [
            "ibc2021-11",
            "ibc2021-1102.1",
            "ibc2021-1103.1",
            "ibc2021-1103.2",
            "ibc2021-1103.2.1",
            "ibc2021-1103.2.10",
            "ibc2021-1103.2.11",
            "ibc2021-1103.2.12",
            "ibc2021-1103.2.13",
            "ibc2021-1103.2.14",
            "ibc2021-1103.2.2",
            "ibc2021-1103.2.3",
            "ibc2021-1103.2.4",
            "ibc2021-1103.2.5",
            "ibc2021-1103.2.6",
            "ibc2021-1103.2.7",
            "ibc2021-1103.2.8",
            "ibc2021-1103.2.9",
            "ibc2021-1106",
            "ibc2021-1106.2",
            "ibc2021-1106.3",
            "ibc2021-1106.4",
            "ibc2021-1106.5",
            "ibc2021-n0052"
          ],
          "applicability_decided": false,
          "sha256": "656e7adefda6a60cae68daffab5f8394038803e4e6397c8a9b01cab4473e1a5e"
        },
        "tables": [
          {
            "id": "table-p004-01",
            "pdf_page_number": 4,
            "source_pdf_page": 359,
            "bbox": [
              46.919,
              441.839,
              289.679,
              634.079
            ],
            "row_count": 12,
            "column_count": 2,
            "header_names": [
              "TOTAL PARKING\nSPACES PROVIDED\nIN PARKING FACILITIES",
              "REQUIRED\nMINIMUM NUMBER OF\nACCESSIBLE SPACES"
            ],
            "header_external": false,
            "cells": [
              [
                "TOTAL PARKING\nSPACES PROVIDED\nIN PARKING FACILITIES",
                "REQUIRED\nMINIMUM NUMBER OF\nACCESSIBLE SPACES"
              ],
              [
                "1 to 25",
                "1"
              ],
              [
                "26 to 50",
                "2"
              ],
              [
                "51 to 75",
                "3"
              ],
              [
                "76 to 100",
                "4"
              ],
              [
                "101 to 150",
                "5"
              ],
              [
                "151 to 200",
                "6"
              ],
              [
                "201 to 300",
                "7"
              ],
              [
                "301 to 400",
                "8"
              ],
              [
                "401 to 500",
                "9"
              ],
              [
                "501 to 1,000",
                "2% of total"
              ],
              [
                "1,001 and over",
                "20, plus one for each 100, or\nfraction thereof, over 1,000"
              ]
            ],
            "source_line_ids": [
              "p004-b025-l001",
              "p004-b025-l002",
              "p004-b025-l003",
              "p004-b026-l001",
              "p004-b026-l002",
              "p004-b027-l001",
              "p004-b027-l002",
              "p004-b027-l003",
              "p004-b028-l001",
              "p004-b028-l002",
              "p004-b029-l001",
              "p004-b029-l002",
              "p004-b030-l001",
              "p004-b030-l002",
              "p004-b031-l001",
              "p004-b031-l002",
              "p004-b032-l001",
              "p004-b032-l002",
              "p004-b033-l001",
              "p004-b033-l002",
              "p004-b034-l001",
              "p004-b034-l002",
              "p004-b035-l001",
              "p004-b035-l002",
              "p004-b036-l001",
              "p004-b036-l002",
              "p004-b037-l001",
              "p004-b037-l002",
              "p004-b037-l003"
            ],
            "source_node_id": "ibc2021-1106.2",
            "caption_node_ids": [
              "ibc2021-n0052"
            ],
            "sha256": "2a547e2a4eae56e60d89b346bce738b32b09ec71fc2ac480de45d241725056a9",
            "source_pdf": "IBE2021_11Accessibility.pdf",
            "binding_method": "Table number in clause and caption plus source page; scope review required"
          }
        ],
        "applicability": {
          "method": "evidence_bound_manual_review",
          "scope": "parking_facility_total_and_accessible_spaces",
          "exceptions": [
            "ibc2021-n0052"
          ],
          "conditions": {
            "conditions": [
              {
                "marker": "where",
                "text": "Where parking is provided, accessible parking spaces shall be provided in compliance with Table 1106."
              },
              {
                "marker": "where",
                "text": "Where more than one parking facility is provided on a site, the number of parking spaces required to be accessible shall be calculated separately for each parking facility."
              }
            ],
            "references": [
              {
                "kind": "table",
                "expression": "1106.2, except",
                "identifiers": [
                  "1106.2"
                ],
                "targets": [
                  {
                    "identifier": "1106.2",
                    "resolved": true,
                    "target_node_id": "ibc2021-1106.2"
                  }
                ]
              },
              {
                "kind": "section",
                "expression": "1106.3 through 1106.5.",
                "identifiers": [
                  "1106.3",
                  "1106.5"
                ],
                "targets": [
                  {
                    "identifier": "1106.3",
                    "resolved": true,
                    "target_node_id": "ibc2021-1106.3"
                  },
                  {
                    "identifier": "1106.5",
                    "resolved": true,
                    "target_node_id": "ibc2021-1106.5"
                  }
                ]
              }
            ]
          },
          "dimension_branches": [],
          "note": "Review ancestors, exceptions, occupancy and target scope; candidate entity matches do not establish applicability."
        }
      },
      "what": {
        "check_function": "legacy_count",
        "required": null,
        "actual": null,
        "unit": null,
        "comparison": ">=",
        "tolerance": 0,
        "tolerance_basis": "No regulatory relaxation; exact comparison",
        "reason_code": "UNKNOWN_APPLICABILITY",
        "explanation": "No reviewed applicability facts supplied",
        "calculation": {